{
  "id": "K1-254",
  "text_number": 254,
  "title_ko": "친구에게 가는 버스",
  "genre": "移動・準備",
  "text_ko": "내일은 친구의 집에 가요. 저는 친구하고 어제 약속했어요. 친구는 지금 다른 도시에 살아요. 우리 집에서는 버스로 가요. 저는 버스로 가는 방법을 몰라요. 그래서 어머니에게 이야기를 해요. 어머니는 그곳에 자주 다녀요.\n\n버스의 시간표를 같이 봐요. 집에는 작은 짐이 있어요. 어머니는 두 가방을 찾아요. 우리는 옷을 따로 넣어요. 친구는 빵을 아주 좋아해요. 친구는 꿀을 아주 좋아해요. 저는 빵하고 꿀을 가져가요.\n\n어머니는 휴대폰을 조금 충전해요. 저는 가방을 문 앞으로 옮겨요. 하지만 가방이 조금 무거워요. 아버지의 도움이 정말 필요해요. 아버지도 같이 가방을 받아요. 우리는 다음 날 아침에 출발해요. 아버지는 정류장까지 같이 와요.\n\n우리는 정류장에서 오래 기다려요. 저는 어머니에게 친구의 이야기를 해요. 버스가 와서 우리는 같이 타요. 그러면 이제 친구에게 전화해요. 친구도 우리 이야기를 들어요. 친구는 집 앞에서 우리를 기다려요. 우리는 버스에서 천천히 내려요.\n\n친구도 가방을 같이 받아요. 우리는 친구의 집으로 들어가요.",
  "translation_ja": "明日は友達の家へ行きます。 私は昨日、友達と約束しました。 友達は今、別の町に住んでいます。 うちからはバスで行きます。 私はバスで行く方法が分かりません。 それで母に話します。 母はその場所によく通います。\n\nバスの時刻表を一緒に見ます。 家には小さな荷物があります。 母は二つのかばんを探します。 私たちは服を別々に入れます。 友達はパンがとても好きです。 友達は蜂蜜がとても好きです。 私はパンと蜂蜜を持っていきます。\n\n母は携帯電話を少し充電します。 私はかばんをドアの前へ移します。 でも、かばんは少し重いです。 父の助けが本当に必要です。 父も一緒にかばんを受け取ります。 私たちは翌日の朝に出発します。 父は停留所まで一緒に来ます。\n\n私たちは停留所で長く待ちます。 私は母に友達の話をします。 バスが来て、私たちは一緒に乗ります。 それなら、ここで友達に電話します。 友達も私たちの話を聞きます。 友達は家の前で私たちを待ちます。 私たちはバスからゆっくり降ります。\n\n友達も一緒にかばんを受け取ります。 私たちは友達の家へ入ります。",
  "scheduled_new_vocab_ids": [
    "ko_k1_0803",
    "ko_k1_0798"
  ],
  "scheduled_review_vocab_ids": [
    "ko_k1_0410",
    "ko_k1_0582",
    "ko_k1_0651",
    "ko_k1_0654",
    "ko_k1_0735",
    "ko_k1_0736",
    "ko_k1_0756",
    "ko_k1_0804",
    "ko_k1_0772",
    "ko_k1_0789",
    "ko_k1_0792"
  ],
  "actually_used_new_vocab_ids": [
    "ko_k1_0798",
    "ko_k1_0803"
  ],
  "actually_used_review_vocab_ids": [
    "ko_k1_0410",
    "ko_k1_0582",
    "ko_k1_0651",
    "ko_k1_0654",
    "ko_k1_0735",
    "ko_k1_0756",
    "ko_k1_0772",
    "ko_k1_0789",
    "ko_k1_0792",
    "ko_k1_0804"
  ],
  "extra_previous_vocab_ids": [
    "ko_k1_0384",
    "ko_k1_0428",
    "ko_k1_0445",
    "ko_k1_0454",
    "ko_k1_0463",
    "ko_k1_0494"
  ],
  "grammar_used": [
    "ko_k1_g02",
    "ko_k1_g03",
    "ko_k1_g11",
    "ko_k1_g19",
    "ko_k1_g20",
    "ko_k1_g21",
    "ko_k1_g22",
    "ko_k1_g23",
    "ko_k1_g24",
    "ko_k1_g25",
    "ko_k1_g26",
    "ko_k1_g27",
    "ko_k1_g28",
    "ko_k1_g29",
    "ko_k1_g30",
    "ko_k1_g31"
  ],
  "eojeol_count": 127,
  "sentence_count": 30,
  "max_sentence_eojeol": 5,
  "coverage": {
    "denominator_N": 128,
    "new_tokens_U": 2,
    "controlled_vocab_coverage": 1.0,
    "previous_vocab_coverage": 0.984375,
    "target_99_met": false
  },
  "validation": {
    "vocab_pass": true,
    "grammar_pass": true,
    "length_pass": true,
    "sentence_length_pass": true,
    "schedule_pass": false,
    "naturalness_review_required": true
  },
  "semantic_schedule_conflicts": [
    {
      "type": "semantic_schedule_conflict",
      "vocab_id": "ko_k1_0736",
      "lemma": "나뭇잎",
      "sense": "leaf",
      "reason": "旅行準備に葉の観察を足すと、予定語のための情景一文になる。",
      "proposed_text_candidates": [
        286,
        245,
        229
      ],
      "proposal_status": "candidate_only_schedule_unchanged",
      "proposal_notes": "タグの場面適合候補。移動後の距離・6教材・他語負荷・本文の意味を人間が再検証する。"
    }
  ],
  "notes": [
    "時刻表は実際の出発準備。그러면は接続の適切さを要確認。",
    "過去Expansionの導入状態はfreezeした全300本予定の仮定。パイロット20本だけの実導入履歴ではない。",
    "本文だけをN/Uの対象にする。titleは別に許可語・文法を照合。日本語訳は制限外。",
    "동생は性別を明示しない語。作者設定と自然な日本語訳では弟を想定した。韓国語から性別が確定したという意味ではない。"
  ],
  "annotation_origin": "Kiwi morphology + generated rule-normalization hypotheses; not gold",
  "sense_overrides": {},
  "annotations": [
    {
      "surface": "내일",
      "lemma": "내일",
      "pos": "noun",
      "sense": "tomorrow",
      "vocab_id": "ko_k1_0070",
      "role": "core",
      "start": 0,
      "end": 2,
      "morph_indices": [
        0
      ],
      "grammar_id": null
    },
    {
      "surface": "은",
      "lemma": null,
      "pos": null,
      "sense": null,
      "vocab_id": null,
      "role": "grammar_function",
      "start": 2,
      "end": 3,
      "morph_indices": [
        1
      ],
      "grammar_id": "ko_k1_g19"
    },
    {
      "surface": "친구",
      "lemma": "친구",
      "pos": "noun",
      "sense": "friend",
      "vocab_id": "ko_k1_0022",
      "role": "core",
      "start": 4,
      "end": 6,
      "morph_indices": [
        2
      ],
      "grammar_id": null
    },
    {
      "surface": "의",
      "lemma": null,
      "pos": null,
      "sense": null,
      "vocab_id": null,
      "role": "grammar_function",
      "start": 6,
      "end": 7,
      "morph_indices": [
        3
      ],
      "grammar_id": "ko_k1_g29"
    },
    {
      "surface": "집",
      "lemma": "집",
      "pos": "noun",
      "sense": "home",
      "vocab_id": "ko_k1_0042",
      "role": "core",
      "start": 8,
      "end": 9,
      "morph_indices": [
        4
      ],
      "grammar_id": null
    },
    {
      "surface": "에",
      "lemma": null,
      "pos": null,
      "sense": null,
      "vocab_id": null,
      "role": "grammar_function",
      "start": 9,
      "end": 10,
      "morph_indices": [
        5
      ],
      "grammar_id": "ko_k1_g22"
    },
    {
      "surface": "가",
      "lemma": "가다",
      "pos": "verb",
      "sense": "go",
      "vocab_id": "ko_k1_0170",
      "role": "core",
      "start": 11,
      "end": 12,
      "morph_indices": [
        6
      ],
      "grammar_id": null
    },
    {
      "surface": "가요",
      "lemma": null,
      "pos": null,
      "sense": null,
      "vocab_id": null,
      "role": "grammar_function",
      "start": 11,
      "end": 13,
      "morph_indices": [
        7
      ],
      "grammar_id": "ko_k1_g02"
    },
    {
      "surface": "저",
      "lemma": "저",
      "pos": "pronoun",
      "sense": "i_humble",
      "vocab_id": "ko_k1_0002",
      "role": "core",
      "start": 15,
      "end": 16,
      "morph_indices": [
        9
      ],
      "grammar_id": null
    },
    {
      "surface": "는",
      "lemma": null,
      "pos": null,
      "sense": null,
      "vocab_id": null,
      "role": "grammar_function",
      "start": 16,
      "end": 17,
      "morph_indices": [
        10
      ],
      "grammar_id": "ko_k1_g19"
    },
    {
      "surface": "친구",
      "lemma": "친구",
      "pos": "noun",
      "sense": "friend",
      "vocab_id": "ko_k1_0022",
      "role": "core",
      "start": 18,
      "end": 20,
      "morph_indices": [
        11
      ],
      "grammar_id": null
    },
    {
      "surface": "하고",
      "lemma": null,
      "pos": null,
      "sense": null,
      "vocab_id": null,
      "role": "grammar_function",
      "start": 20,
      "end": 22,
      "morph_indices": [
        12
      ],
      "grammar_id": "ko_k1_g25"
    },
    {
      "surface": "어제",
      "lemma": "어제",
      "pos": "noun",
      "sense": "yesterday",
      "vocab_id": "ko_k1_0069",
      "role": "core",
      "start": 23,
      "end": 25,
      "morph_indices": [
        13
      ],
      "grammar_id": null
    },
    {
      "surface": "약속했",
      "lemma": "약속하다",
      "pos": "verb",
      "sense": "promise",
      "vocab_id": "ko_k1_0756",
      "role": "scheduled_review",
      "start": 26,
      "end": 29,
      "morph_indices": [
        14,
        15
      ],
      "grammar_id": null
    },
    {
      "surface": "했",
      "lemma": null,
      "pos": null,
      "sense": null,
      "vocab_id": null,
      "role": "grammar_function",
      "start": 28,
      "end": 29,
      "morph_indices": [
        16
      ],
      "grammar_id": "ko_k1_g03"
    },
    {
      "surface": "어요",
      "lemma": null,
      "pos": null,
      "sense": null,
      "vocab_id": null,
      "role": "grammar_function",
      "start": 29,
      "end": 31,
      "morph_indices": [
        17
      ],
      "grammar_id": "ko_k1_g02"
    },
    {
      "surface": "친구",
      "lemma": "친구",
      "pos": "noun",
      "sense": "friend",
      "vocab_id": "ko_k1_0022",
      "role": "core",
      "start": 33,
      "end": 35,
      "morph_indices": [
        19
      ],
      "grammar_id": null
    },
    {
      "surface": "는",
      "lemma": null,
      "pos": null,
      "sense": null,
      "vocab_id": null,
      "role": "grammar_function",
      "start": 35,
      "end": 36,
      "morph_indices": [
        20
      ],
      "grammar_id": "ko_k1_g19"
    },
    {
      "surface": "지금",
      "lemma": "지금",
      "pos": "adverb",
      "sense": "now",
      "vocab_id": "ko_k1_0071",
      "role": "core",
      "start": 37,
      "end": 39,
      "morph_indices": [
        21
      ],
      "grammar_id": null
    },
    {
      "surface": "다른",
      "lemma": "다르다",
      "pos": "adjective",
      "sense": "different",
      "vocab_id": "ko_k1_0262",
      "role": "core",
      "start": 40,
      "end": 42,
      "morph_indices": [
        22
      ],
      "grammar_id": null
    },
    {
      "surface": "도시",
      "lemma": "도시",
      "pos": "noun",
      "sense": "city",
      "vocab_id": "ko_k1_0067",
      "role": "core",
      "start": 43,
      "end": 45,
      "morph_indices": [
        23
      ],
      "grammar_id": null
    },
    {
      "surface": "에",
      "lemma": null,
      "pos": null,
      "sense": null,
      "vocab_id": null,
      "role": "grammar_function",
      "start": 45,
      "end": 46,
      "morph_indices": [
        24
      ],
      "grammar_id": "ko_k1_g22"
    },
    {
      "surface": "살",
      "lemma": "살다",
      "pos": "verb",
      "sense": "live_reside",
      "vocab_id": "ko_k1_0223",
      "role": "core",
      "start": 47,
      "end": 48,
      "morph_indices": [
        25
      ],
      "grammar_id": null
    },
    {